{
  "statement": "O grego 'praÿs' não significa 'fraco', mas força contida / domada — usado para o cavalo treinado.",
  "certainty": 0.85,
  "status": "majoritario",
  "source": "léxico do grego koiné; uso clássico do termo",
  "schools_in_dispute": [],
  "anachronism_check": "pass",
  "elenchus_note": "Mantido; conotação bem atestada no koiné."
}
